{
  "schema_version": "highambench-faithfulness-0.2",
  "role": "roundtrip-judge",
  "task_id": "P11-T3",
  "paper_sha256": "72b7521848be07971a6721ea0356bb898c63e21b8ad3aa109fee8f41517284a5",
  "blind_translation_sha256": "c7b5d693a4500628d62df8a916505c292ed9dd8c98b98cd7a614a54cc5ef5603",
  "semantic_checklist": [
    {
      "id": "S01",
      "status": "pass",
      "paper_evidence": "The verified PDF is the 2006 Numerische Mathematik article, volume 105, pages 299-313. Theorem 1 on printed page 302 contains the selected equation (7) and its surrounding equations (3)-(8).",
      "translation_evidence": "The translation targets the leading-block Gram-defect estimate for the computed factors associated with CGS-P.",
      "reasoning": "The paper version and principal source passage are correctly selected, although later checks identify substantive translation mismatches."
    },
    {
      "id": "S02",
      "status": "fail",
      "paper_evidence": "The paper fixes A in R^(m x n), m>=n, rank(A)=n, and considers the partial computed factors Q_k and R_k for k=1,...,n at the machine unit epsilon_M.",
      "translation_evidence": "The translation quantifies over an epsilon-indexed family F, a separate second-order analysis package, every positive epsilon, and k in Fin n.",
      "reasoning": "The matrix dimensions and k-to-k+1 index conversion are correct, but the epsilon-indexed family and analysis package are additional binders not present in the paper result."
    },
    {
      "id": "S03",
      "status": "fail",
      "paper_evidence": "For one Algorithm 2 computation, condition (3) is required for every k, after which Theorem 1 asserts its conclusions for every k.",
      "translation_evidence": "The order is universal family, universal analysis package, universal positive epsilon, a master-radius antecedent, and then universal k.",
      "reasoning": "Uniform dependence across all positive epsilon values and dependence on an externally supplied analysis package change the paper's quantifier structure and witness requirements."
    },
    {
      "id": "S04",
      "status": "fail",
      "paper_evidence": "The inherited hypotheses are full column rank, computation by Algorithm 2 in the stated floating-point model, and c4(m,k) epsilon_M kappa_2(R_k)^2<1 for every k.",
      "translation_evidence": "The family additionally assumes stored exact inverses, positive diagonals, uniform R and inverse-norm bounds, multiple validity radii, and a detailed trace; the analysis package assumes factorization, normal-equation, and reverse-norm second-order estimates.",
      "reasoning": "Several paper conclusions or proof ingredients are promoted to independent hypotheses, and the master-radius restrictions are stronger than the paper's stated premise."
    },
    {
      "id": "S05",
      "status": "fail",
      "paper_evidence": "Theorem 1 jointly concludes equations (4), (5), (6), (7), and (8).",
      "translation_evidence": "The translation's sole conclusion is an explicit-remainder variant of equation (7); variants of (4), (5), and part of the norm comparison are assumptions, while (8) is absent.",
      "reasoning": "The surrounding multi-part theorem is not conclusion-complete."
    },
    {
      "id": "S06",
      "status": "pass",
      "paper_evidence": "The paper uses first-column blocks A_k and Q_k, the leading principal block R_k, transpose, I_k, and kappa_2(R_k)=norm(R_k)_2 norm(R_k^(-1))_2.",
      "translation_evidence": "D009-D013 and the associated matrix dependencies interpret these as leading restrictions, ordinary matrix operations, the identity Gram defect, spectral norms, and an exact leading-block inverse.",
      "reasoning": "Apart from the numerical coefficient error assessed in S10, the nontrivial matrix operators and condition-number construction are interpreted correctly."
    },
    {
      "id": "S07",
      "status": "pass",
      "paper_evidence": "A_k is exact input data, whereas Q_k and R_k are computed matrices; R_k^(-1) is the exact mathematical inverse of the computed block used in its condition number.",
      "translation_evidence": "The translation distinguishes fixed exact A, epsilon-dependent computed Q and R, and a stored exact two-sided inverse; the displayed defect is evaluated exactly on computed Q.",
      "reasoning": "Exact inputs, computed factors, and exact mathematical post-processing are not conflated."
    },
    {
      "id": "S08",
      "status": "pass",
      "paper_evidence": "Algorithm 2 computes r_kk as sqrt(psi_k-phi_k)sqrt(psi_k+phi_k), unlike Algorithm 1's norm(v_k), and then computes q_k=v_k/r_kk.",
      "translation_evidence": "D050 models the initial column and subsequent projection, residual, computed norms, pythagorean diagonal, and division steps.",
      "reasoning": "The computation trace remains specifically linked to CGS-P rather than standard CGS-S."
    },
    {
      "id": "S09",
      "status": "pass",
      "paper_evidence": "Equation (7) uses the matrix spectral 2-norm of I_k-Q_k^TQ_k, and kappa_2 uses spectral 2-norms; vector norms in Algorithm 2 are Euclidean.",
      "translation_evidence": "D012, D013, D037, D064, and the matrix norm instance specify induced Euclidean operator norms for matrices and Euclidean norms for vectors.",
      "reasoning": "The norm kind, unsquared defect norm, and normwise interpretation match."
    },
    {
      "id": "S10",
      "status": "fail",
      "paper_evidence": "Equation (2) defines c1(m,p)=2 sqrt(2) m p+2 sqrt(p) for p>=2, c2(m,p)=3.5 m p^2-1.5 m p+16p, and c4=c2+2c1.",
      "translation_evidence": "D030 defines alpha(m,p)=2 sqrt(2mp)+2 sqrt(p) for p!=1, and c=beta+2alpha.",
      "reasoning": "The paper multiplies 2 sqrt(2) by m p, whereas the translation places m p inside the square root. This changes the leading coefficient and the smallness premise for every nontrivial block."
    },
    {
      "id": "S11",
      "status": "fail",
      "paper_evidence": "The paper assumes IEEE floating-point arithmetic, states a normalized-range relative-error model, and adopts a first-order convention; it does not specify a complete abstract operation semantics.",
      "translation_evidence": "The translation quantifies over abstract modeled operations and an arbitrary normalized predicate, adds dot-product and norm axioms, does not require all operation results to satisfy that predicate, and does not require a particular IEEE format or rounding mode.",
      "reasoning": "The translated arithmetic class is neither exactly the paper's stated IEEE setting nor a justified complete formalization of it."
    },
    {
      "id": "S12",
      "status": "fail",
      "paper_evidence": "Condition (3) is the strict inequality c4 epsilon_M kappa_2(R_k)^2<1, and equation (7) is stated only to within O(epsilon_M^2).",
      "translation_evidence": "The antecedent is epsilon<=min(1,rhoN,rhoC,rhoA), its embedded condition uses the mistranslated coefficient, and the conclusion is an exact inequality with an explicit C_k epsilon^2 term.",
      "reasoning": "The antecedent and conclusion have materially changed logical strength, with both restrictive and strengthening changes rather than a single implication-preserving refinement."
    },
    {
      "id": "S13",
      "status": "pass",
      "paper_evidence": "Equation (7) measures loss of column orthogonality by norm(I_k-Q_k^TQ_k)_2.",
      "translation_evidence": "The conclusion measures the same spectral-norm Gram defect of the first p computed columns.",
      "reasoning": "The selected error notion remains loss of orthogonality and is not replaced by a residual, backward-error, Frobenius, or componentwise notion."
    },
    {
      "id": "S14",
      "status": "fail",
      "paper_evidence": "Theorem 1 globally omits O(epsilon_M^2), and the appendix derives equation (7) with an unspecified O(epsilon_M^2) remainder; no quantitative remainder constant or uniformity radius is supplied.",
      "translation_evidence": "The translation asserts an exact quadratic remainder C_k epsilon^2 built from arbitrary supplied coefficients f_k, g_k, h_k and uniform norm bounds over an epsilon radius.",
      "reasoning": "This is a new exact second-order theorem under new assumptions, not a faithful representation of the paper's informal first-order qualification."
    },
    {
      "id": "S15",
      "status": "fail",
      "paper_evidence": "The source concerns real full-rank matrices computed by a particular IEEE floating-point execution of CGS-P.",
      "translation_evidence": "The proposition ranges over abstract epsilon-indexed arithmetic families satisfying packaged axioms, but only when they also admit a supplied uniform second-order analysis and epsilon lies below several radii.",
      "reasoning": "It simultaneously generalizes beyond IEEE executions and specializes to a narrower class with uniform analysis packages; this mixed domain change is not classified or justified by the paper."
    },
    {
      "id": "S16",
      "status": "pass",
      "paper_evidence": "The paper's full-rank setting and strict condition are intended to ensure nonsingular real partial factors and exclude CGS-P breakdown.",
      "translation_evidence": "An inhabited package enforces positive compatible dimensions, full rank, positive diagonals, exact leading inverses, and positive radii; simple exact computations can satisfy these requirements.",
      "reasoning": "The translated hypotheses are restrictive but not inherently contradictory, and the Gram-defect conclusion is not an algebraic tautology. Their semantic excess is addressed under hypotheses and specialization."
    }
  ],
  "implications": {
    "translation_implies_paper": {
      "verdict": "no",